{
  "schema": "otsec.config/0.1",
  "kind": "config.snapshot",
  "asset_id": "2b7d4e10-8c3f-4a5b-9e21-7c4f0d6a8b13",
  "invocation_id": "8a2f6c41-5b7e-4d93-a0c2-1e9f3b7d6a51",
  "operation_id": "sel.config.read_all",
  "adapter": {
    "id": "sel-751-ascii",
    "version": "0.3.0-example"
  },
  "register_version": 5,
  "target": "simulated",
  "retrieved_at": "2026-10-27T09:10:06.0Z",
  "rule": "sel-751-sho/1",
  "transcript": {
    "ref": "sha256:c1c14e12d2c2858f4b2659ebd4533027f20af195c0e99413e6a6086f0ddb633e",
    "sha256": "c1c14e12d2c2858f4b2659ebd4533027f20af195c0e99413e6a6086f0ddb633e",
    "length": 6397
  },
  "sections": [
    {
      "command": "SHO 1",
      "class": "group.1",
      "state": "present",
      "sensitive": false,
      "span": {
        "offset": 350,
        "length": 889
      },
      "sha256": "b521789ac1004daf295cb5f55222cf3981a4fec82d32774c57ce17db56daeb19",
      "settings": [
        {
          "name": "RID",
          "value": "SEL-751"
        },
        {
          "name": "TID",
          "value": "FEEDER RELAY"
        },
        {
          "name": "CTR",
          "value": "120"
        },
        {
          "name": "CTRN",
          "value": "120"
        },
        {
          "name": "PTR",
          "value": "180.00"
        },
        {
          "name": "LEA_S_R",
          "value": "180.00"
        },
        {
          "name": "LEA_S_SC",
          "value": "4.80"
        },
        {
          "name": "DELTA_Y",
          "value": "DELTA"
        },
        {
          "name": "VSCONN",
          "value": "VS"
        },
        {
          "name": "SINGLEV",
          "value": "N"
        },
        {
          "name": "VNOM",
          "value": "120.00"
        },
        {
          "name": "Z1MAG",
          "value": "2.14"
        },
        {
          "name": "Z1ANG",
          "value": "68.86"
        },
        {
          "name": "Z0MAG",
          "value": "6.38"
        },
        {
          "name": "Z0ANG",
          "value": "72.47"
        },
        {
          "name": "Z0SMAG",
          "value": "0.36"
        },
        {
          "name": "Z0SANG",
          "value": "84.61"
        },
        {
          "name": "LL",
          "value": "4.84"
        },
        {
          "name": "EFLOC",
          "value": "N"
        },
        {
          "name": "50P1P",
          "value": "10.00"
        },
        {
          "name": "50P1D",
          "value": "0.00"
        },
        {
          "name": "50P1TC",
          "value": "1"
        },
        {
          "name": "TDURD",
          "value": "0.5"
        },
        {
          "name": "CFD",
          "value": "1.0"
        },
        {
          "name": "TR",
          "value": "ORED50T OR ORED51T OR ORED81T OR REMTRIP OR OC OR SV04T"
        },
        {
          "name": "REMTRIP",
          "value": "0"
        },
        {
          "name": "ULTRIP",
          "value": "NOT ( 51P1P OR 51G1P OR 51N1P OR 52A )"
        },
        {
          "name": "52A",
          "value": "0"
        },
        {
          "name": "52B",
          "value": "NOT 52A"
        },
        {
          "name": "CL",
          "value": "SV03T AND LT02 OR CC"
        },
        {
          "name": "ULCL",
          "value": "0"
        }
      ]
    },
    {
      "command": "SHO 2",
      "class": "group.2",
      "state": "present",
      "sensitive": false,
      "span": {
        "offset": 1257,
        "length": 889
      },
      "sha256": "23c42568c22e1030d8b7a6f4629c9b6f4bef8a47e889670c1d2d7b5a04e923cd",
      "settings": [
        {
          "name": "RID",
          "value": "SEL-751"
        },
        {
          "name": "TID",
          "value": "FEEDER RELAY"
        },
        {
          "name": "CTR",
          "value": "120"
        },
        {
          "name": "CTRN",
          "value": "120"
        },
        {
          "name": "PTR",
          "value": "180.00"
        },
        {
          "name": "LEA_S_R",
          "value": "180.00"
        },
        {
          "name": "LEA_S_SC",
          "value": "4.80"
        },
        {
          "name": "DELTA_Y",
          "value": "DELTA"
        },
        {
          "name": "VSCONN",
          "value": "VS"
        },
        {
          "name": "SINGLEV",
          "value": "N"
        },
        {
          "name": "VNOM",
          "value": "120.00"
        },
        {
          "name": "Z1MAG",
          "value": "2.14"
        },
        {
          "name": "Z1ANG",
          "value": "68.86"
        },
        {
          "name": "Z0MAG",
          "value": "6.38"
        },
        {
          "name": "Z0ANG",
          "value": "72.47"
        },
        {
          "name": "Z0SMAG",
          "value": "0.36"
        },
        {
          "name": "Z0SANG",
          "value": "84.61"
        },
        {
          "name": "LL",
          "value": "4.84"
        },
        {
          "name": "EFLOC",
          "value": "N"
        },
        {
          "name": "50P1P",
          "value": "10.00"
        },
        {
          "name": "50P1D",
          "value": "0.00"
        },
        {
          "name": "50P1TC",
          "value": "1"
        },
        {
          "name": "TDURD",
          "value": "0.5"
        },
        {
          "name": "CFD",
          "value": "1.0"
        },
        {
          "name": "TR",
          "value": "ORED50T OR ORED51T OR ORED81T OR REMTRIP OR OC OR SV04T"
        },
        {
          "name": "REMTRIP",
          "value": "0"
        },
        {
          "name": "ULTRIP",
          "value": "NOT ( 51P1P OR 51G1P OR 51N1P OR 52A )"
        },
        {
          "name": "52A",
          "value": "0"
        },
        {
          "name": "52B",
          "value": "NOT 52A"
        },
        {
          "name": "CL",
          "value": "SV03T AND LT02 OR CC"
        },
        {
          "name": "ULCL",
          "value": "0"
        }
      ]
    },
    {
      "command": "SHO 3",
      "class": "group.3",
      "state": "present",
      "sensitive": false,
      "span": {
        "offset": 2164,
        "length": 889
      },
      "sha256": "8007360f438cae03ffae350012e41c7c5c6bf92fb4dca9430fa51293a13321fb",
      "settings": [
        {
          "name": "RID",
          "value": "SEL-751"
        },
        {
          "name": "TID",
          "value": "FEEDER RELAY"
        },
        {
          "name": "CTR",
          "value": "120"
        },
        {
          "name": "CTRN",
          "value": "120"
        },
        {
          "name": "PTR",
          "value": "180.00"
        },
        {
          "name": "LEA_S_R",
          "value": "180.00"
        },
        {
          "name": "LEA_S_SC",
          "value": "4.80"
        },
        {
          "name": "DELTA_Y",
          "value": "DELTA"
        },
        {
          "name": "VSCONN",
          "value": "VS"
        },
        {
          "name": "SINGLEV",
          "value": "N"
        },
        {
          "name": "VNOM",
          "value": "120.00"
        },
        {
          "name": "Z1MAG",
          "value": "2.14"
        },
        {
          "name": "Z1ANG",
          "value": "68.86"
        },
        {
          "name": "Z0MAG",
          "value": "6.38"
        },
        {
          "name": "Z0ANG",
          "value": "72.47"
        },
        {
          "name": "Z0SMAG",
          "value": "0.36"
        },
        {
          "name": "Z0SANG",
          "value": "84.61"
        },
        {
          "name": "LL",
          "value": "4.84"
        },
        {
          "name": "EFLOC",
          "value": "N"
        },
        {
          "name": "50P1P",
          "value": "10.00"
        },
        {
          "name": "50P1D",
          "value": "0.00"
        },
        {
          "name": "50P1TC",
          "value": "1"
        },
        {
          "name": "TDURD",
          "value": "0.5"
        },
        {
          "name": "CFD",
          "value": "1.0"
        },
        {
          "name": "TR",
          "value": "ORED50T OR ORED51T OR ORED81T OR REMTRIP OR OC OR SV04T"
        },
        {
          "name": "REMTRIP",
          "value": "0"
        },
        {
          "name": "ULTRIP",
          "value": "NOT ( 51P1P OR 51G1P OR 51N1P OR 52A )"
        },
        {
          "name": "52A",
          "value": "0"
        },
        {
          "name": "52B",
          "value": "NOT 52A"
        },
        {
          "name": "CL",
          "value": "SV03T AND LT02 OR CC"
        },
        {
          "name": "ULCL",
          "value": "0"
        }
      ]
    },
    {
      "command": "SHO 4",
      "class": "group.4",
      "state": "present",
      "sensitive": false,
      "span": {
        "offset": 3071,
        "length": 889
      },
      "sha256": "d206d0ee81109741993c6e6f28c47e50fe79584605850258055646aa067cd05a",
      "settings": [
        {
          "name": "RID",
          "value": "SEL-751"
        },
        {
          "name": "TID",
          "value": "FEEDER RELAY"
        },
        {
          "name": "CTR",
          "value": "120"
        },
        {
          "name": "CTRN",
          "value": "120"
        },
        {
          "name": "PTR",
          "value": "180.00"
        },
        {
          "name": "LEA_S_R",
          "value": "180.00"
        },
        {
          "name": "LEA_S_SC",
          "value": "4.80"
        },
        {
          "name": "DELTA_Y",
          "value": "DELTA"
        },
        {
          "name": "VSCONN",
          "value": "VS"
        },
        {
          "name": "SINGLEV",
          "value": "N"
        },
        {
          "name": "VNOM",
          "value": "120.00"
        },
        {
          "name": "Z1MAG",
          "value": "2.14"
        },
        {
          "name": "Z1ANG",
          "value": "68.86"
        },
        {
          "name": "Z0MAG",